"id","section_id","section name","title","created"10367,9,"Day & Night","Shirley visit is a whirl",18/06/07 00:0010368,4,"Other Sport","Vaughan urged to quit ODI role",17/06/07 00:0010366,1,"UK News","Firm set for 'ghost ships' victory",18/06/07 11:4510365,4,"Other Sport","Strauss hits back",18/06/07 00:0010364,22,"City & Business","Sainsbury's sales to 'outshine' Tesco",18/06/07 00:00901,1,"UK News","Iraq security handover &apos;imminent&apos;",17/06/06 00:0010363,4,"Other Sport","Vaughan in split decision",18/06/07 00:0010362,22,"City & Business","Fashion icon leads move to economic strength",18/06/07 00:0010361,22,"City & Business","Barclays agrees to drop 'Nazi' eagle logo",18/06/07 00:0010358,1,"UK News","Police worker admits terrorism leak",18/06/07 11:1510359,4,"Other Sport","McGhee appointed at Well",18/06/07 11:1710360,17,"The Crusader","Insurance storm is finally calmed",18/06/07 00:0010357,4,"Other Sport","Mauresmo has the bottle for another vintage Wimbledon",18/06/07 00:0010356,40,"Columnists","Why we cannot allow Blair's last act to be the betrayal of Britain",18/06/07 00:0010355,41,"Express Comment","Brown lands yet another tax blow on our pensions",18/06/07 00:0010354,4,"Other Sport","Not Murray's year",18/06/07 00:0010353,1,"UK News","Johnston release set back",18/06/07 00:0010352,1,"UK News","Princes tell of her zest for life",18/06/07 00:0010351,1,"UK News","Backing for President Blair",18/06/07 00:00904,1,"UK News","West End debut for US film actress",17/06/06 00:0010224,4,"Other Sport","Zahavi: I've been bung out to dry",17/06/07 00:00255,1,"UK News","9/11 - The conspiracy theories ",22/02/07 00:00260,4,"Other Sport","The McClaren era",22/02/07 14:53902,1,"UK News","Paul Newman hints at last film role",17/06/06 00:0019112,40,"Columnists","England school of hard knocks ",14/09/07 00:001001,1,"UK News","Get real Ronaldo",13/07/06 00:00261,1,"UK News","9/11 - The Aftermath",22/02/07 00:00259,1,"UK News","9/11 - Timetable of terror",22/02/07 14:5110225,4,"Other Sport","Lionheart Hamilton is ready to rule the world",17/06/07 00:0010227,4,"Other Sport","Police move in on bungs suspects",17/06/07 00:0010228,7,"Have Your Say","Can we trust the Tories any more than Labour?",17/06/07 00:0010229,7,"Have Your Say","Have you ever been pushed to breaking point?",17/06/07 00:0010230,7,"Have Your Say","Do children need discipline not pills?",17/06/07 00:0010231,7,"Have Your Say","Royal marriages: Why do they go wrong?",17/06/07 00:0010232,1,"UK News","Longer Midsomer nights",17/06/07 00:0010233,1,"UK News","It's time for Cameron to come out fighting",17/06/07 00:00900,1,"UK News","Amnesty nets nearly 18,000 weapons",17/06/06 00:0010350,1,"UK News","Will Brown let us vote on Europe?",18/06/07 00:0010348,4,"Other Sport","Gear joins Worcester",18/06/07 10:4710349,4,"Other Sport","Jankovic reigns on Sharapova's parade",18/06/07 00:0010347,7,"Have Your Say","Are Britain's drinking problems exaggerated? ",18/06/07 00:0010346,1,"UK News","Half of us' have damaged liver caused by drink",18/06/07 00:0010345,4,"Other Sport","Roddick rocks on ",18/06/07 00:0010344,1,"UK News","Five Britons die in safari plane crash",18/06/07 00:0010343,4,"Other Sport","Mexico's hats off to Hitman",18/06/07 00:0010342,1,"UK News","A click cure for Monday's blues",18/06/07 00:0010341,1,"UK News","Homes glut - but prices are still rising",18/06/07 00:0010340,1,"UK News","QE2 to become floating Dubai hotel",18/06/07 10:1510337,1,"UK News","March of the warriors",18/06/07 00:0010338,4,"Other Sport","Robinson backs Dallaglio to lift England",18/06/07 00:0010336,4,"Other Sport","Brace for Riley earns Cullen one more life",18/06/07 00:0010334,1,"UK News","Heirless' Sir Ben kicks out family from estate cottage",18/06/07 00:0010335,1,"UK News","Rosehips offer hope to arthritis sufferers",18/06/07 00:0010333,1,"UK News","Thanks to you Alan, business is blooming",18/06/07 00:0010332,4,"Other Sport","Becks savours Real happy ending",18/06/07 09:4710329,4,"Other Sport","Smith not guilty of Giants robbery",18/06/07 00:0010331,4,"Other Sport","Hamilton stays cool after US success",18/06/07 09:4710328,1,"UK News","Britain at risk of flood catastrophe",18/06/07 00:0010327,1,"UK News","Builders take top spot at hitting jackpot",18/06/07 00:0010325,1,"UK News","Robbers and perverts in switch to open jails",18/06/07 00:0010326,4,"Other Sport","Rebel ready for Palace",18/06/07 00:0010324,7,"Have Your Say","Would we respect the monarchy more if Diana was alive? ",18/06/07 00:0010323,1,"UK News","Hannah suspect's extradition halted",18/06/07 09:1510322,4,"Other Sport","Bowman gunning for compatriots",18/06/07 00:0010321,1,"UK News","Diana's life could have been saved says doctor",18/06/07 00:0010319,7,"Have Your Say","Will Paul be forgotten in weeks? ",18/06/07 00:0010320,55,"Big Brother","BB's Charley in a lap flap",18/06/07 00:0010318,10,"Express Yourself","BB's Charley in a lap flap",18/06/07 00:0010316,7,"Have Your Say","Has Brown betrayed the nation's elderly? ",18/06/07 00:0010317,1,"UK News","Singer Paul is the best of British",18/06/07 00:0010315,1,"UK News","Brown's £11bn stealth tax raid on pensions",18/06/07 00:0010313,4,"Other Sport","Cabrera shocked by major step",18/06/07 08:4710314,1,"UK News","Pool death charge close",18/06/07 00:0010312,4,"Other Sport","American Beauty",18/06/07 00:0010311,4,"Other Sport","Beckham says adios as a real winner",18/06/07 00:0010310,1,"UK News","12-year-olds will be given anti-cancer vaccine ",18/06/07 00:0010309,4,"Other Sport","Strauss is back in key for England",18/06/07 00:0010307,1,"UK News","Hastings back for World Cup",18/06/07 00:0010308,1,"UK News","Moonwalk smashes records",18/06/07 00:0010306,1,"UK News","Salmond to discuss joint approach",18/06/07 00:0010305,1,"UK News","SNP: Referendum next year",18/06/07 00:0010304,4,"Other Sport","McCabe remains confident",18/06/07 08:1710302,4,"Other Sport","UEFA to probe under-21 'racism'",18/06/07 08:1710303,4,"Other Sport","Agent voices Grave concerns",18/06/07 08:1710301,4,"Other Sport","Middlesborough's bid for Anderson",18/06/07 00:0010300,4,"Other Sport","Smith's big job",18/06/07 00:0010299,4,"Other Sport","Celtic's big deal",18/06/07 00:0010298,4,"Other Sport","Dargo: I'm no moneygrabber",18/06/07 00:0010296,4,"Other Sport","Dressing down for Hibs",18/06/07 00:0010297,1,"UK News","TB badger cull 'not cost effective'",18/06/07 07:4510295,4,"Other Sport","Brit pack are ready for a Major move",18/06/07 00:0010294,20,"TV Guide","CURRENT AFFAIRS: Mind The Gap Year: Tonight, 8pm, ITV1",18/06/07 00:0010293,20,"TV Guide","ENTERTAINMENT: 24 Hours With...Laurence Llewelyn-Bowen, 10pm, ITV1",18/06/07 00:0010291,1,"UK News","Firms plan smoking breaks crackdown",18/06/07 07:1510292,20,"TV Guide","DRAMA: The Time of Your Life, 9pm, ITV1",18/06/07 00:0010290,1,"UK News","Mental health detention bid debated",18/06/07 06:1510289,1,"UK News","Fraudster could be stripped of &#163;98m",18/06/07 04:4510287,1,"UK News","Met worker faces terror leak charge",18/06/07 04:1510288,1,"UK News","Aviation 'scapegoated' on emissions",18/06/07 04:4510286,1,"UK News","Blair begins last full week as PM",18/06/07 04:1510284,1,"UK News","Disabled people'treated badly'",18/06/07 02:1510285,1,"UK News","25% of trusts miss superbug targets",18/06/07 03:4510282,1,"UK News","Women drink drivers on the increase",18/06/07 01:1510283,4,"Other Sport","Angel in heaven at Oakmont",18/06/07 01:1710281,1,"UK News","Brown urged to tackle housing",18/06/07 00:1510280,4,"Other Sport","Cruel course winning battle",17/06/07 23:1710278,4,"Other Sport","England U21 secure semi spot",17/06/07 22:1710279,4,"Other Sport","Beckham wins Spanish title",17/06/07 22:4710276,4,"Other Sport","More joy for Hamilton",17/06/07 20:4710277,1,"UK News","Video threat to kill BBC journalist",17/06/07 22:1510275,4,"Other Sport","Jankovic upsets Sharapova",17/06/07 20:1710274,1,"UK News","EU referendum 'not ruled out'",17/06/07 20:1510273,4,"Other Sport","England lose late wickets",17/06/07 19:4710272,1,"UK News","Video shows threat to kill Johnston",17/06/07 19:1510270,1,"UK News","Pensioner, 93, 'stabbed himself'",17/06/07 18:4510271,4,"Other Sport","Welcome half-century for Strauss",17/06/07 18:4710269,1,"UK News","British tourists die in plane crash",17/06/07 18:4510268,1,"UK News","Freedom hopes fade for journalist",17/06/07 18:4510267,4,"Other Sport","Dramatic win for Rhinos",17/06/07 18:1710265,1,"UK News","Clean-up under way after floods",17/06/07 18:1510266,4,"Other Sport","Early starters make progress",17/06/07 18:1710264,1,"UK News","Five tourists dead in Malawi crash",17/06/07 18:1510263,4,"Other Sport","Roddick equals Queen's record",17/06/07 17:4710262,4,"Other Sport","Chanderpaul frustrates England",17/06/07 17:1710261,1,"UK News","Iraq road death soldier named",17/06/07 16:4510259,4,"Other Sport","Sidebottom leads England charge",17/06/07 15:4710260,1,"UK News","Veterans remember Falklands War",17/06/07 16:1510258,1,"UK News","Cadbury to axe 5,000 jobs - report",17/06/07 15:4510256,4,"Other Sport","Robinson backs Dallaglio to make squad",17/06/07 15:1710257,4,"Other Sport","Warnock waiting for right job",17/06/07 15:1710255,1,"UK News","Warning after 'tombstoning' death",17/06/07 15:1510252,4,"Other Sport","Yeung expected to step up Blues interest",17/06/07 13:1710253,4,"Other Sport","England get in the swing",17/06/07 13:4710251,4,"Other Sport","Hoggard claims early wicket",17/06/07 13:1710250,55,"Big Brother","Oh Brother! Day 18",16/06/07 00:0010249,1,"UK News","Divorce No 2 for Anne'",17/06/07 00:0010248,1,"UK News","Opponents of EU treaty accused of being 'terrorists'",17/06/07 00:0010247,1,"UK News","Hamas vows to free kidnapped reporter",17/06/07 00:009063,1,"UK News","4 million think they will never afford a house",07/06/07 00:009064,4,"Other Sport","Stars save Mac from the sack",07/06/07 00:009065,1,"UK News","Prezza jokes with the nurses",07/06/07 00:009066,4,"Other Sport","Vaughan is all at sea over Fredalo",07/06/07 00:009067,1,"UK News","Putin has little time for Blair in missiles spat",07/06/07 00:009068,1,"UK News","Pay row as NHS is back in black",07/06/07 00:00229,1,"UK News","Bin Laden rebuilds Al Qaeda",20/02/07 00:008907,40,"Columnists","How can I stop this infection?",05/06/07 00:00232,7,"Have Your Say","Should inheritance tax be abolished?",20/02/07 00:0010246,1,"UK News","Here come the WAGS",17/06/07 00:00235,1,"UK News","Prescott costs us an extra £600,000",21/02/07 00:00256,1,"UK News","9/11 - The terrorists",22/02/07 00:00257,4,"Other Sport","The Greatest Series: The 2005 Ashes",22/02/07 14:43903,1,"UK News","Eriksson laments England&apos;s missed chances",17/06/06 00:00905,1,"UK News","Why worry about teen girls getting pregnant, asks children&apos;s expert",19/06/06 00:00906,1,"UK News","Nothing to fear",19/06/06 00:00907,1,"UK News","The World Cup is Mick&apos;s main goal",19/06/06 00:00910,1,"UK News","Rooney is unleashed",20/06/06 00:00911,1,"UK News","Tax break for all working mothers",20/06/06 00:00909,1,"UK News","Crooks will go free as prisons are full",19/06/06 00:00912,1,"UK News","Nicole to say ‘I do&apos; on Sunday",20/06/06 00:00913,1,"UK News","Labour climbdown over knife crime",20/06/06 00:00914,1,"UK News","Owen agony as England limp on",21/06/06 00:008905,40,"Columnists","If greedy doctors are not careful they will kill the Health Service",05/06/07 00:008906,40,"Columnists","Divine intervention or miracle of nature?",05/06/07 00:008926,25,"Travel","Succumb to the Seychelles",05/06/07 00:009042,1,"UK News","Post workers back strike action",07/06/07 06:159025,55,"Big Brother","Giving women a bad name",06/06/07 00:009026,25,"Travel","The hidden treasures of Jordan",06/06/07 00:009027,1,"UK News","Human error' cause of drug recall",06/06/07 18:159028,1,"UK News","British soldier killed in action",06/06/07 18:159029,4,"Other Sport","Hammers sign Toon skipper for £7m",06/06/07 00:009030,1,"UK News","Deadbeat dads' list 'a gimmick'",06/06/07 18:459031,1,"UK News","Family to sue MoD for custody death",06/06/07 19:459032,1,"UK News","Airport security staff suspended",06/06/07 21:459033,1,"UK News","PM confident on climate change deal",07/06/07 04:159077,4,"Other Sport","Danny won't give Wigan any quarter",07/06/07 00:008903,27,"Blogs","Oh no. I think I like Hazel Blears",05/06/07 00:008904,41,"Express Comment","Po-faced new Puritanism must be resisted by us all",05/06/07 00:008902,25,"Travel","An escape for an Eastender",05/06/07 00:0010245,1,"UK News","Tough talks on EU future - Beckett",17/06/07 12:458900,11,"Health","Learn how to manage your life as a diabetic",05/06/07 00:008899,11,"Health","Becoming a guinea pig gave me back my life",05/06/07 00:008898,22,"City & Business","Putin turns screw on BP in gas row",05/06/07 00:008897,22,"City & Business","Boots pension peace bid",05/06/07 00:008896,22,"City & Business","Job cuts loom for HMV UK",05/06/07 00:008895,9,"Day & Night","Moggach lays into Spielberg",05/06/07 00:008894,9,"Day & Night","Sophie as a young poser",05/06/07 00:008893,9,"Day & Night","Too much information, Vicky",05/06/07 00:008890,1,"UK News","Brown in £9,700 donation row",05/06/07 00:008888,4,"Other Sport","Newcastle open talks with Barton",05/06/07 00:008889,1,"UK News","Man charged with career girl murder",05/06/07 00:008887,1,"UK News","Honours probe costs hit &#163;750,000",05/06/07 13:158886,25,"Travel","The man with the golden tan",05/06/07 00:008885,1,"UK News","Nato warns Russia over arms threat to Europe",05/06/07 00:008884,1,"UK News","Millionaire father is sectioned 'after beating his girl, 2'",05/06/07 00:008883,25,"Travel","French luxury at Spanish prices",05/06/07 00:008882,1,"UK News","Green light for re-using old graves",05/06/07 12:458881,25,"Travel","Easy does it for Caribbean nightclubbing",05/06/07 00:008880,1,"UK News","Mums who let fussy kids eat what they like",05/06/07 00:008879,55,"Big Brother","Oh Brother! Day seven...",05/06/07 00:008878,55,"Big Brother","Fan quits job to watch Big Brother full time",05/06/07 00:008876,25,"Travel","A heady Andean adventure",05/06/07 00:008877,1,"UK News","Fan quits job to watch Big Brother full time",05/06/07 00:008875,1,"UK News","New alcohol strategy targets drunks",05/06/07 11:158874,1,"UK News","Cash loans on a credit card cost a fortune",05/06/07 00:008873,1,"UK News","William and Harry at war with Channel 4 ",05/06/07 00:008872,1,"UK News","£1,000 'tax' if you want to convert a loft",05/06/07 00:008871,1,"UK News","Princes renew Diana photos plea",05/06/07 10:158870,1,"UK News","Prisoner Paris and a very glamorous police mugshot",05/06/07 00:008869,7,"Have Your Say","Do you believe 7/7 was a conspiracy?",05/06/07 00:008868,7,"Have Your Say","Should Brown be allowed to receive donations?",05/06/07 00:008867,7,"Have Your Say","Does Paris deserve her jail sentence?",05/06/07 00:008866,7,"Have Your Say","Has the Nanny State has gone mad?",05/06/07 00:008865,55,"Big Brother","Ziggy is spoilt for choice",05/06/07 00:008864,10,"Express Yourself","Ziggy is spoilt for choice",05/06/07 00:008863,4,"Other Sport","Don't put blame on Mac",05/06/07 00:008862,4,"Other Sport","I'd stage Palace coup for 2012",05/06/07 00:008861,4,"Other Sport","Forget Brazil, this is it, boys",05/06/07 00:008860,4,"Other Sport","Carragher staying loyal to Liverpool",05/06/07 00:008859,20,"TV Guide","TRAVEL: Gavin&#8200;Stamp’s Orient Express, 7.15pm, Five",05/06/07 00:008858,20,"TV Guide","DOCUMENTARY: Andrew Marr’s History Of Modern Britain, 9pm, BBC2",05/06/07 00:008857,20,"TV Guide","MAKEOVER: Trinny & Susannah Undress, 8pm, ITV1",05/06/07 00:008855,1,"UK News","Blaze father 'killed his children'",05/06/07 08:158854,1,"UK News","24% of Muslims think 7/7 raids were MI5 plot",05/06/07 00:008852,27,"Blogs","Thanks for the laughs, Mariam",05/06/07 00:008851,1,"UK News","Now pubs told: Show warnings on drink",05/06/07 00:008850,1,"UK News","MPs in warning over EU justice veto",05/06/07 07:458849,27,"Blogs","Pensions enjoy their share of success",05/06/07 00:008848,1,"UK News","BT chief visits reservists in Basra",05/06/07 07:158846,1,"UK News","Drinking crackdown to be unveiled",05/06/07 04:458845,1,"UK News","Care home bodies to be drug tested",05/06/07 03:458844,1,"UK News","Adults 'scared to let children out'",05/06/07 03:458843,1,"UK News","Ministers urge national Britain day",05/06/07 01:158842,1,"UK News","Speed cameras 'should be hidden'",05/06/07 01:158840,1,"UK News","Man remanded on Kate murder charge",05/06/07 01:158839,1,"UK News","Call to toughen citizenship tests",04/06/07 21:458838,1,"UK News","Survey spotlights UK Muslims' views",04/06/07 21:158836,4,"Other Sport","Gerrard and Carragher to stay at Liverpool",03/06/07 00:008837,1,"UK News","UK warns Russia over nuclear threat",04/06/07 20:458835,1,"UK News","Conductor jailed for groping youths",04/06/07 16:158833,4,"Other Sport","Bates wins Leeds vote",04/06/07 00:008832,1,"UK News","Crews battle chemical factory blaze",04/06/07 14:158831,55,"Big Brother","Ziggy's hot for Posh wannabe",04/06/07 00:008830,9,"Day & Night","Keira's about to make a splash",04/06/07 00:008828,7,"Have Your Say","Is the new Olympic logo a waste of money? ",04/06/07 00:008829,9,"Day & Night","How to decorate a Posh house",04/06/07 00:008827,1,"UK News","London's 2012 Olympic logo revealed",04/06/07 00:008826,9,"Day & Night","Gasping for more Robbie",04/06/07 00:008825,9,"Day & Night","Aunt gives Macca a Welsh tongue lashing ",04/06/07 00:008824,9,"Day & Night","Show us a leg, Sue!",04/06/07 00:008823,9,"Day & Night","Police reunion tensions",04/06/07 00:008822,1,"UK News","Ex-Marine deported on sex charges",04/06/07 12:158821,1,"UK News","UK extradition bid foolish - Putin",04/06/07 12:158820,10,"Express Yourself","Have a champagne wedding on a cava budget",04/06/07 00:008819,22,"City & Business","Lloyd deal tones up Whitbread",04/06/07 00:008818,10,"Express Yourself","Revamp your life",04/06/07 00:008817,14,"Food & Recipes","Artichoke and avocado salad with truffle vinaigrette",03/06/07 00:008816,22,"City & Business","Tote takes lead in TV turf war",04/06/07 00:008815,22,"City & Business","Southern Water sell-off may open takeover tap",04/06/07 00:008814,55,"Big Brother","Oh Brother! Day six... ",04/06/07 00:008813,17,"The Crusader","Rescued from a total wash-out",04/06/07 00:008812,41,"Express Comment","Let's hope NHS superbug crackdown can save lives",04/06/07 00:008811,40,"Columnists","Recycling: Don't turn us all into refuseniks",04/06/07 00:008809,7,"Have Your Say","Can Gordon win over the Muslim vote?",04/06/07 00:008810,7,"Have Your Say","Should British troops be pulled out of Iraq TODAY?",04/06/07 00:008808,7,"Have Your Say","Should celebrities do charity work for nothing?",04/06/07 00:008804,1,"UK News","Wogan's £1,477 an hour",04/06/07 00:008803,1,"UK News","Father sectioned after girl injured",04/06/07 10:458802,1,"UK News","Prescott in further tests after malaria is ruled out",04/06/07 00:008801,1,"UK News","Workload hampers probation officers",04/06/07 00:008800,1,"UK News","Gordon's terror battle on two fronts",04/06/07 00:008799,1,"UK News","Robust' Cameron set to crush rebels",04/06/07 00:008798,1,"UK News","1,000 hurt after G8 riots",04/06/07 00:008797,4,"Other Sport","Terry: Defeat could be the end",04/06/07 00:008796,4,"Other Sport","Changes on the cards",04/06/07 00:008795,1,"UK News","Bathing your baby too often can be harmful ",04/06/07 00:001002,1,"UK News","Gloom for Brown as jobless figures hit six-year high",13/07/06 00:008794,4,"Other Sport","Toshack already over Giggs break-up",04/06/07 00:008793,1,"UK News","Drug girl brother in rape case",04/06/07 00:008792,4,"Other Sport","Mourinho's attack on me went too far",04/06/07 00:008790,4,"Other Sport","Partisans and Patty no match for Maria",04/06/07 00:008791,4,"Other Sport","McCabe: League say we'll be OK",04/06/07 00:008789,4,"Other Sport","Wilko and rout for Brian",04/06/07 00:008788,4,"Other Sport","Eddie's picking out the positives",04/06/07 00:008787,4,"Other Sport","Thomas in trouble over tour too far",04/06/07 00:008786,4,"Other Sport","All that glitters really looks Goldie",04/06/07 00:008785,1,"UK News","Chilling' plot to bomb JFK",04/06/07 00:008784,1,"UK News","Date woman still missing",04/06/07 00:008783,1,"UK News","How 15m drivers are baffled by road signs",04/06/07 00:001003,1,"UK News","Jurgen&apos;s too tired to go on",13/07/06 00:008782,4,"Other Sport","Agony is a Sterne lesson for Dredge",04/06/07 00:008781,1,"UK News","Live a longer life ... with creosote",04/06/07 00:008780,1,"UK News","Bill for failed asylum seekers hitting £75m",04/06/07 00:008779,4,"Other Sport","Prior's one-day warning to Nixon",04/06/07 00:008778,4,"Other Sport","Pitch perfect for Harmy to deliver",04/06/07 00:008777,4,"Other Sport","Sharp justice at ref justice",04/06/07 00:008776,12,"Fashion & Beauty","Our addiction to Coco",04/06/07 00:008775,1,"UK News","From Wags to hoodies, new words we're all talking about",04/06/07 00:008774,4,"Other Sport","O'Sullevan leads accolades for Dettori's Derby success",04/06/07 00:008773,1,"UK News","The Welsh BBC broadcast ... with subtitles in Polish",04/06/07 00:008772,1,"UK News","Map that shames our pollution blackspots",04/06/07 00:008770,1,"UK News","Now it's harder to query soaring council tax bills",04/06/07 00:008771,1,"UK News","Doctor how helped to save Houllier may be struck off",04/06/07 00:001004,1,"UK News","Why career women lead unhealthy lives",13/07/06 00:008769,4,"Other Sport","I will beat the boo boys",04/06/07 00:008768,4,"Other Sport","Dallaglio back in World Cup picture",04/06/07 00:008767,4,"Other Sport","Barton in £5m move to Magpies",04/06/07 00:008766,4,"Other Sport","More Derby celebrations for Dettori",04/06/07 00:008765,10,"Express Yourself","Ziggy's hot for Posh wannabe",04/06/07 00:008764,4,"Other Sport","The price of England duty",04/06/07 00:008763,1,"UK News","Man and children die in house fire",04/06/07 07:458762,1,"UK News","Breakthrough in fight against breast cancer",04/06/07 00:008761,1,"UK News","Spot checks in superbug war",04/06/07 00:008760,1,"UK News","Plan to pull our boys out of Iraq within one year",04/06/07 00:008759,1,"UK News","JK Rowling and a magical new look",04/06/07 00:008758,20,"TV Guide","DOCUMENTARY: Paul Merton In China, 9pm, Five",04/06/07 00:001005,1,"UK News","£2.8m for Shakespeare book",14/07/06 00:008757,20,"TV Guide","FILM: The Long Kiss Goodnight, 10pm, E4 ****",04/06/07 00:008756,20,"TV Guide","HISTORY: Peter And Dan Snow: 20th Century Battlefields, 9pm, BBC2",04/06/07 00:008754,1,"UK News","Kate police find body in woods",04/06/07 04:451006,1,"UK News","Outrage at picture of dying Diana in magazine",14/07/06 00:008755,1,"UK News","Seven laws a day' in Blair decade",04/06/07 04:458753,1,"UK News","Brothers in court over boat murder",04/06/07 04:458752,1,"UK News","Mental illness rising among staff",04/06/07 04:458750,1,"UK News","Government accused of cover up",04/06/07 03:458751,1,"UK News","PM calls for 'true voice of Islam'",04/06/07 04:458749,1,"UK News","Cancer patients hail drug ruling",04/06/07 02:458748,1,"UK News","Hospitals face superbug crackdown",04/06/07 02:458747,1,"UK News","Harman 'most trustworthy' candidate",04/06/07 02:158746,1,"UK News","Charity in call for seasonal grants",04/06/07 01:151007,1,"UK News","Price at the pump hits an all time high",14/07/06 00:008745,1,"UK News","Couple murder probe: Man sectioned",03/06/07 22:158744,1,"UK News","Murder charge mother hanged in cell",03/06/07 22:158743,1,"UK News","Prescott in hospital with infection",03/06/07 20:158741,1,"UK News","G8 has 'duty' over global warming",03/06/07 18:458742,1,"UK News","Brown to clamp down on terror",03/06/07 19:158740,27,"Blogs","You've walked into a trap, Dave",03/06/07 00:008739,1,"UK News","Sunglasses raise risk of cancer",03/06/07 00:008738,1,"UK News","Queen's favourite",03/06/07 00:008737,1,"UK News","Appeal over mother's disappearance",03/06/07 15:151008,1,"UK News","Nine police to rescue as Kate snaps at paparazzi",14/07/06 00:008735,1,"UK News","Brown's £110billion pension black hole",03/06/07 00:008733,1,"UK News","Day Joanna kept a gunman talking",03/06/07 00:008734,1,"UK News","Brown's £110billion pension black hole",03/06/07 00:008732,1,"UK News","Can Gordon Brown charm the Queen?",03/06/07 00:008731,1,"UK News","Wimbledon's strawberries under threat",03/06/07 00:008730,1,"UK News","Can science fiction beat Bin Laden?",03/06/07 00:008729,1,"UK News","Too tawdry for TV",03/06/07 00:008728,1,"UK News","Airport security who would rather read sleep than X-ray bags",03/06/07 00:008727,1,"UK News","Battle lines drawn up as MPs debate abortion",03/06/07 00:008726,1,"UK News","Brady to sue over 'private' photos he took on Moors",03/06/07 00:008725,1,"UK News","Brits leading US TV's invasion",03/06/07 00:001009,1,"UK News","Oops... I broke the cup",14/07/06 00:008723,1,"UK News","I love my brother but would never let him beat me",03/06/07 00:008724,1,"UK News","FAILURE",03/06/07 00:008722,1,"UK News","The KGB killers",03/06/07 00:008721,1,"UK News","Paris stays bubbly over jail",03/06/07 00:008720,1,"UK News","Tusk trade in balance",03/06/07 00:00