"id","section_id","section name","title","created"8719,1,"UK News","School sports days come racing back",03/06/07 00:008718,55,"Big Brother","Girls are all breathless - and then a man arrives",03/06/07 00:008717,10,"Express Yourself","Girls are all breathless - and then a man arrives",03/06/07 00:008716,7,"Have Your Say","Is Labour trying to rob us for all we're worth? ",03/06/07 00:008715,7,"Have Your Say","Should we save the sports day? ",03/06/07 00:001010,1,"UK News","10,000 Britons wait to escape warzone as death toll grows",17/07/06 00:008713,7,"Have Your Say","Is American TV better that British?",03/06/07 00:008714,7,"Have Your Say","Should we pay for public sector pensions?",03/06/07 00:008712,4,"Other Sport","Becks: I'll always be there for England",03/06/07 00:008711,4,"Other Sport","Frankie breaks Derby duck at last",03/06/07 00:008710,4,"Other Sport","England talisman Beck to old self",03/06/07 00:008709,4,"Other Sport","Owen is desperate for the net",03/06/07 00:008708,1,"UK News","400 police injured in demonstration",03/06/07 11:458707,4,"Other Sport","Lampard the odd man out",03/06/07 00:008706,4,"Other Sport","Giggs' farewell fails to inspire doomed Wales",03/06/07 00:008704,4,"Other Sport","Make up your mind, Thierry",03/06/07 00:008705,4,"Other Sport","Kaka: England's game too rough",03/06/07 00:008703,4,"Other Sport","No more tinkering for Ranieri",03/06/07 00:008702,4,"Other Sport","United we stand",03/06/07 00:008700,4,"Other Sport","Charlton braced for huge cutbacks",03/06/07 00:008701,1,"UK News","Alcohol branding to end",03/06/07 11:158699,4,"Other Sport","Ricky backs Barton to be a hit",03/06/07 00:008698,4,"Other Sport","Ashes avenger Vaughan",03/06/07 00:008696,4,"Other Sport","Jenkins defends summer tours",03/06/07 00:008697,4,"Other Sport","Ashton fury at lazy stars",03/06/07 00:008695,4,"Other Sport","Maria injury crisis grows",03/06/07 00:008694,4,"Other Sport","High praise for Dettori",03/06/07 00:008693,4,"Other Sport","Dettori's Derby delight",03/06/07 00:008692,4,"Other Sport","Pole start for raining champ Stoner",03/06/07 00:008691,4,"Other Sport","Bradley keeps his eyes on main prize",03/06/07 00:008690,41,"Express Comment","Council tax appeals: Justice delayed is justice denied",03/06/07 00:008689,40,"Columnists","Let children play in the streets",03/06/07 00:008688,40,"Columnists","Princes to set the feathers flying?",03/06/07 00:008687,40,"Columnists","Our efforts go for nothing if the big polluters don't stop",03/06/07 00:008686,25,"Travel","The cut-price Caribbean",03/06/07 00:008685,25,"Travel","Bespoke holiday is a tour de force",03/06/07 00:008684,1,"UK News","Cocaine 'did nothing' for Johnson",03/06/07 09:158683,25,"Travel","Our magnificent men in their flying machines",03/06/07 00:008682,40,"Columnists","Steamed-up Poll's right to rant as FA let anarchy rule",03/06/07 00:008680,1,"UK News","Blair to hold talks with Merkel",03/06/07 07:158681,40,"Columnists","Sam's baffled",03/06/07 00:008679,1,"UK News","Terror cell's 'airport attack plan'",03/06/07 07:158678,1,"UK News","Security scare 'exposed at airport'",03/06/07 01:151011,1,"UK News","We&apos;ve never sold honours snaps Blair",17/07/06 00:008677,1,"UK News","Lottery raises &#163;150m for 2012 ",03/06/07 00:458676,1,"UK News","Peers attack nuclear waste plans ",03/06/07 00:458674,1,"UK News","Cameron defiant over grammars",02/06/07 22:458675,1,"UK News","Labour deputy hopefuls' union views",03/06/07 00:158673,1,"UK News","Deputy PM Prescott in hospital",02/06/07 20:151012,1,"UK News","Ronaldo told to shut up",17/07/06 00:008672,1,"UK News","No news on Woolmer death - widow",02/06/07 15:158671,1,"UK News","Brown defends new terror law plans",02/06/07 15:158670,1,"UK News","&#163;1m to find Loch Ness monster",02/06/07 12:158669,1,"UK News","Man held after youth stabbing death",02/06/07 12:158668,1,"UK News","UK oil worker kidnapped in Nigeria",02/06/07 12:158667,55,"Big Brother","Oh Brother! Day Four... ",02/06/07 00:008665,25,"Travel","A faraway posting to join the Saints",02/06/07 00:008666,40,"Columnists","So what are you going to do then, arrest me for smoking?",02/06/07 00:008664,25,"Travel","Saddling up in the Midwest",02/06/07 00:008663,25,"Travel","Come join the revolution in vibrant Cuba",02/06/07 00:008662,1,"UK News","Number plate change could cut crime",02/06/07 11:158661,13,"Gardening","Trimming those hellebores now will save so much bother later",02/06/07 00:001013,1,"UK News","Wayne&apos;s very weird world",17/07/06 00:008660,13,"Gardening","Help!",02/06/07 00:008659,40,"Columnists","Potted pets that are nature's very own fly sprays",02/06/07 00:008658,24,"Motoring","Cee'd can grow to be winner for Kia",02/06/07 00:008657,40,"Columnists","A Zimmer of hope for us all",02/06/07 00:008656,40,"Columnists","Vandals handled with care",02/06/07 00:008655,41,"Express Comment","A civilised society must protect our children first",02/06/07 00:008654,22,"City & Business","Share-price fears in Sport Direct fiasco",02/06/07 00:008653,22,"City & Business","Hands sells Thresher",02/06/07 00:001014,1,"UK News","House prices rise by £3,000 a week",17/07/06 00:008652,22,"City & Business","RBS in talks to smooth bid",02/06/07 00:008651,4,"Other Sport","It shows there really is no place like home",02/06/07 00:008650,4,"Other Sport","Struggle to shed Sheva",02/06/07 00:008649,4,"Other Sport","Lampard's £7m salary demands too rich for Juve",02/06/07 00:001015,1,"UK News","Bush and Blair&apos;s toe-curling chat",18/07/06 00:008647,4,"Other Sport","Fergie now in forward gear",02/06/07 00:008648,4,"Other Sport","It's just criminal to blame only me",02/06/07 00:008646,4,"Other Sport","Bates is forced to wait",02/06/07 00:008645,4,"Other Sport","Keane wants pals reunited",02/06/07 00:001016,1,"UK News","O&apos;Leary told to explain himself",18/07/06 00:008644,4,"Other Sport","Ronnie is on cup campaign trail",02/06/07 00:008643,4,"Other Sport","Percy proves life's no beach",02/06/07 00:008642,4,"Other Sport","Give 'em a kicking",02/06/07 00:008641,4,"Other Sport","It's not much fun for Venus",02/06/07 00:008640,4,"Other Sport","Rossi on the slide",02/06/07 00:001017,1,"UK News","Biggest exodus since Dunkirk",18/07/06 00:008638,4,"Other Sport","Pedal to metal for Grand Prix bid",02/06/07 00:008639,4,"Other Sport","Carroll is ready for race heat",02/06/07 00:008637,4,"Other Sport","Moores after Flower power",02/06/07 00:008636,4,"Other Sport","Barker holds on for Kiwis ",02/06/07 00:001018,1,"UK News","Alarm over TV casino adverts",18/07/06 00:008635,4,"Other Sport","Just no pleasing a moody Monty",02/06/07 00:008634,4,"Other Sport","Calzaghe lined up for great Dane bid",02/06/07 00:008633,4,"Other Sport","Sanders can be the colonel",02/06/07 00:001019,1,"UK News","Weng&apos;s keen on £10m Curt",18/07/06 00:008632,4,"Other Sport","Smith drops spares Anderson blushes",02/06/07 00:001020,1,"UK News","Meltdown - deaths warning as Britain gets hotter than ever",19/07/06 00:001021,1,"UK News","Why we&apos;re all descended from Germans",19/07/06 00:008628,1,"UK News","Talk to get cheaper for millions as BT sparks price war",02/06/07 00:008627,1,"UK News","Great handbag debate",02/06/07 00:001022,1,"UK News","Open hostility",19/07/06 00:008626,1,"UK News","Cider sales overtake beer for the first time",02/06/07 00:008624,1,"UK News","Abbas military threat over Johnston",02/06/07 09:158625,1,"UK News","British hostage is paraded on video",02/06/07 00:008623,1,"UK News","Three held in probe over double killing",02/06/07 00:008622,1,"UK News","Six life sentences for Somali rapist",02/06/07 00:008621,1,"UK News","I'm Kate's mate",02/06/07 00:001023,1,"UK News","Tsunami terror returns",19/07/06 00:008620,1,"UK News","20mph limit 'a waste of money'",02/06/07 00:008619,1,"UK News","Stop giving me money!",02/06/07 00:008618,1,"UK News","New TB test that may save lives of millions",02/06/07 00:008617,1,"UK News","White House tribute is puzzling Parliament",02/06/07 00:001024,1,"UK News","Chelsea set to sign £18m Cole",19/07/06 00:008616,1,"UK News","Gurkha's visa victory",02/06/07 00:008615,1,"UK News","A diamond skull... yours for £50m",02/06/07 00:008614,1,"UK News","Red-haired family victims of thugs",02/06/07 08:458612,1,"UK News","How to stop the garden thieves from raking it in",02/06/07 00:008613,1,"UK News","Man held after girl killed in crash",02/06/07 08:458611,4,"Other Sport","Becks is back with a bang",02/06/07 00:001025,1,"UK News","Blair breaks his promise to make our streets safe",20/07/06 00:008610,4,"Other Sport","Jonny to make a stand",02/06/07 00:008609,4,"Other Sport","Becks gives some hope",02/06/07 00:008608,4,"Other Sport","Home is where the heart is for fans",02/06/07 00:008607,7,"Have Your Say","Should all paedophiles be left to rot in jail?",02/06/07 00:008606,7,"Have Your Say","Has Labour made a sham of our pensions?",02/06/07 00:008605,7,"Have Your Say","Is all Reality TV a shame on our society?",02/06/07 00:008604,55,"Big Brother","I am ashamed of Big Brother, says man in charge",02/06/07 00:008603,1,"UK News","I am ashamed of Big Brother, says man in charge",02/06/07 00:0010244,1,"UK News","NHS spends millions on drug that turns children into 'drones'",17/06/07 00:008601,1,"UK News","Another blow for Cameron as the Tories drop in polls",02/06/07 00:008600,1,"UK News","The £3,000-a-year retirement rip-off hidden in Labour's pensions shake-up",02/06/07 00:008599,1,"UK News","Don't send child sex perverts to jail, says child protection chief",02/06/07 00:008597,1,"UK News","Bank fees test case needed - judge",02/06/07 05:158598,1,"UK News","Three quizzed over bodies in house",02/06/07 06:458596,1,"UK News","Make Britain polite - Respect Czar",02/06/07 03:451026,1,"UK News","Prescott to escape with a ticking off over sleaze",20/07/06 00:008595,1,"UK News","Bank sorry for lost mortgage mail",02/06/07 03:158594,1,"UK News","Charity attack G8 leaders on aid",02/06/07 03:158593,1,"UK News","Murder probe begins into shooting",02/06/07 02:151027,1,"UK News","Gunned down in front of his sons",20/07/06 00:008592,1,"UK News","Ex-Army chief seeks Iraq withdrawal",02/06/07 01:15